<!-- This sample uses nota.xml from https://github.com/nota-game/nota -->
<!-- If you need xml namespaces in the xpath querys, you need to define those in the project root-->
<Project xmlns="https://raw.githubusercontent.com/LokiMidgard/PdfGenerator/master/PdfGenerator/XMLImport.xsd"
           xmlns:xsi="http://www.w3.org/2001/XMLSchema-instance"
         xmlns:nota='http://nota.org/schema/nota'
  xmlns:misc='http://nota.org/schema/misc'
  xmlns:lebewesen="http://nota.org/schema/wesen"
  xmlns:kultur="http://nota.org/schema/kultur"
  xmlns:profession="http://nota.org/schema/profession"
  xmlns:talent="http://nota.org/schema/talent"
  xmlns:fertigkeit="http://nota.org/schema/fertigkeit"
  xmlns:besonderheit="http://nota.org/schema/besonderheit"
  xmlns:aktionen="http://nota.org/schema/kampf/aktionen"
  xmlns:ausstattung="http://nota.org/schema/kampf/ausstattung"
         xsi:schemaLocation="https://raw.githubusercontent.com/LokiMidgard/PdfGenerator/master/PdfGenerator/XMLImport.xsd ../PDFGenerator/XMLImport.xsd">
  <Template Context="//nota:Daten/aktionen:Aktionen/*" Width="63 mm" Height="88 mm">
    <Text left="9 mm" top="3mm" width="43 mm" height="8mm">
      <Paragraph  Alignment="Center" EmSize="12" FontStyle="Bold">
        <Run>
          <TextPath>@Name</TextPath>
        </Run>
      </Paragraph>
    </Text>

    <Image left="52 mm" top="3 mm" width="6 mm" height="8 mm" ImageLocation="Flamme.png" IsVisible="true" />

    <Text left="3 mm" top="3 mm" width="6 mm" height="8 mm">
      <Paragraph  Alignment="Center" EmSize="7">
        <Run>
          <TextPath>@Kosten</TextPath>
        </Run>
      </Paragraph>
    </Text>


    <Text left="3mm" top="70 mm" width="55mm" height="6 mm" >
      <Paragraph FontStyle="Italic" EmSize="7">
        <Run>
          <TextPath>./aktionen:Beschreibung</TextPath>
        </Run>
      </Paragraph>
    </Text>
    <Text left="3mm" top="76 mm" width="55 mm" height="6.3 mm" >
      <Paragraph FontStyle="Italic" EmSize="7">
        <Run>
          <TextPath>./aktionen:Beschreibung</TextPath>
        </Run>
      </Paragraph>
    </Text>

    <Text left="3 mm" top="11 mm" width="55mm" height="58.1mm" >
      <Paragraph FontStyle="Italic" EmSize="7" IsVisiblePath="./aktionen:Beschreibung">
        <Run>
          <TextPath>./aktionen:Beschreibung</TextPath>
        </Run>
      </Paragraph>

      <Paragraph IsVisiblePath="./aktionen:Bedingung" BeforeParagraph="4mm" AfterParagraph="2mm" FontStyle="Bold" EmSize="8">
        <Run>
          <Text>Bedingung</Text>
        </Run>
      </Paragraph>
      <Paragraph IsVisiblePath="./aktionen:Bedingung" BeforeParagraph="1mm" AfterParagraph="0mm" EmSize="7">
        <Run>
          <TextPath>./aktionen:Bedingung</TextPath>
        </Run>
      </Paragraph>

      <Paragraph IsVisiblePath="./aktionen:InstantEffektBedingung" BeforeParagraph="4mm" AfterParagraph="2mm" FontStyle="Bold" EmSize="8">
        <Run>
          <Text>Augenblicklicher Effekt</Text>
        </Run>
      </Paragraph>
      <Paragraph IsVisiblePath="./aktionen:InstantEffekt" BeforeParagraph="1mm" AfterParagraph="0mm" EmSize="7">
        <Run>
          <TextPath>./aktionen:InstantEffekt</TextPath>
        </Run>
      </Paragraph>

      <Paragraph IsVisiblePath="./aktionen:GarantierterEffekt" BeforeParagraph="4mm" AfterParagraph="2mm" FontStyle="Bold" EmSize="8">
        <Run>
          <Text>Garantierter Effekt</Text>
        </Run>
      </Paragraph>
      <Paragraph IsVisiblePath="./aktionen:GarantierterEffekt" BeforeParagraph="1mm" AfterParagraph="0mm" EmSize="7">
        <Run>
          <TextPath>./aktionen:GarantierterEffekt</TextPath>
        </Run>
      </Paragraph>

      <Paragraph IsVisiblePath="./aktionen:OffensivErfolg" BeforeParagraph="4mm" AfterParagraph="2mm" FontStyle="Bold" EmSize="8">
        <Run>
          <Text>Offensiv Erfolg</Text>
        </Run>
      </Paragraph>
      <Paragraph IsVisiblePath="./aktionen:OffensivErfolg" BeforeParagraph="1mm" AfterParagraph="0mm" EmSize="7">
        <Run>
          <TextPath>./aktionen:OffensivErfolg</TextPath>
        </Run>
      </Paragraph>

      <Paragraph IsVisiblePath="./aktionen:DefensivErfolg" BeforeParagraph="4mm" AfterParagraph="2mm" FontStyle="Bold" EmSize="8">
        <Run>
          <Text>Defensiver Erfolg</Text>
        </Run>
      </Paragraph>
      <Paragraph IsVisiblePath="./aktionen:DefensivErfolg" BeforeParagraph="1mm" AfterParagraph="0mm" EmSize="7">
        <Run>
          <TextPath>./aktionen:DefensivErfolg</TextPath>
        </Run>
      </Paragraph>

      <Paragraph IsVisiblePath="./aktionen:SekundärErfolg" BeforeParagraph="4mm" AfterParagraph="2mm" FontStyle="Bold" EmSize="8">
        <Run>
          <Text>Sekundeärer Erfolg</Text>
        </Run>
      </Paragraph>
      <Paragraph IsVisiblePath="./aktionen:SekundärErfolg" BeforeParagraph="1mm" AfterParagraph="0mm" EmSize="7">
        <Run>
          <TextPath>./aktionen:SekundärErfolg</TextPath>
        </Run>
      </Paragraph>

      <Paragraph IsVisiblePath="./aktionen:OffensivMiserfolg" BeforeParagraph="4mm" AfterParagraph="2mm" FontStyle="Bold" EmSize="8">
        <Run>
          <Text>Offensiver Misserfolg</Text>
        </Run>
      </Paragraph>
      <Paragraph IsVisiblePath="./aktionen:OffensivMiserfolg" BeforeParagraph="1mm" AfterParagraph="0mm" EmSize="7">
        <Run>
          <TextPath>./aktionen:OffensivMiserfolg</TextPath>
        </Run>
      </Paragraph>

      <Paragraph IsVisiblePath="./aktionen:DefensivMiserfolg" BeforeParagraph="4mm" AfterParagraph="2mm" FontStyle="Bold" EmSize="8">
        <Run>
          <Text>Defensiver Misserfolg</Text>
        </Run>
      </Paragraph>
      <Paragraph IsVisiblePath="./aktionen:DefensivMiserfolg" BeforeParagraph="1mm" AfterParagraph="0mm" EmSize="7">
        <Run>
          <TextPath>./aktionen:DefensivMiserfolg</TextPath>
        </Run>
      </Paragraph>


      <Paragraph IsVisiblePath="./aktionen:SekundärMiserfolg" BeforeParagraph="4mm" AfterParagraph="2mm" FontStyle="Bold" EmSize="8">
        <Run>
          <Text>Säkundärer Misserfolg</Text>
        </Run>
      </Paragraph>
      <Paragraph IsVisiblePath="./aktionen:SekundärMiserfolg" BeforeParagraph="1mm" AfterParagraph="0mm" EmSize="7">
        <Run>
          <TextPath>./aktionen:SekundärMiserfolg</TextPath>
        </Run>
      </Paragraph>



    </Text>


  </Template>


</Project>